{
  "seed": {
    "numpy": 45,
    "blenderproc": "446"
  },
  
  "models_path": "./models",
  "cc_textures_path": "/home/paul/akamav/dev/projects/blenderproc/cc0_textures",
  
  "camera": {
    "px": 600,
    "py": 600,
    "u0": 320,
    "v0": 240,
    "width": 640,
    "height": 480,
    "randomize_params_percent": 5.0
  },
  
  "rendering": {
    "max_samples": 64,
    "denoiser": "OPTIX"
  },
  
  "scene": {
    "room_size_multiplier_min": 5.0,
    "room_size_multiplier_max": 10.0,
    "simulate_physics": true,
    "max_textures": 50,
    "ambient_strength": 0.5,
    "debug_initial_state": true,
    
    "distractors": {
      "min_count": 25,
      "max_count": 30,
      "min_size_rel_scene": 0.01,
      "max_size_rel_scene": 0.07,
      "custom_distractors_path": null,
      "custom_distractor_prob": 0.5,
      "displacement_max": 0.0,
      "pbr_noise": 0.5,
      "emissive_prob": 0.1,
      "emissive_strength_min": 2.0,
      "emissive_strength_max": 5.0,
      "texture_blacklist": []
    },
    
    "lights": {
      "min_count": 1,
      "max_count": 2,
      "min_intensity": 100,
      "max_intensity": 200
    },
    
    "objects": {
      "min_count": 1,
      "max_count": 1,
      "multiple_occurrences": false,
      "EB60x40x22": {
        "textures": ["Plastic011_4K-JPG", "Plastic012A_4K-JPG"],
        "initial_rotation": [270, 0, 0]
      },
      "EB60x40x32": {
        "textures": ["Plastic011_4K-JPG", "Plastic012A_4K-JPG"],
        "initial_rotation": [270, 0, 0]
      },
      "Eurobox 20L 40x22x30 v4": {
        "textures": ["Plastic011_4K-JPG", "Plastic012A_4K-JPG"],
        "initial_rotation": [0, 0, 90]
      },
      "Eurobox_61L_600x400x320_mm_v1": {
        "textures": ["Plastic011_4K-JPG", "Plastic012A_4K-JPG"],
        "initial_rotation": [0, 0, -90]
      },
      "scale_noise": 0.15,
      "displacement_max": 0.0,
      "pbr_noise": 0.3,
      "cam_min_dist_rel": 2.5,
      "cam_max_dist_rel": 3.5
    }
  },
  
  "dataset": {
    "num_scenes": 40,
    "scenes_per_run": 1,
    "images_per_scene": 5,
    "empty_images_per_scene": 3,
    "train_split": 0.7,
    "val_split": 0.2,
    "test_split": 0.1
  },
  
  "output": {
    "save_path": "./output/euro_box_dataset_v2",
    "yolo_format": "yolov11-obb",
    "save_depth": false,
    "save_normals": false,
    "save_segmentation": false,
    "save_pose": true,
    
    "detection_params": {
      "min_bbox_side_px": 10,
      "min_visibility": 0.3,
      "force_fully_visible": false,
      "occlusion_samples": 150
    }
  }
}
